{
    "$schema": "http://json-schema.org/draft-04/schema#",
    "type": "object",
    "properties": {
        "id": {
            "type": "string"
        },
        "title": {
            "type": "string"
        },
        "publisher": {
            "type": "string"
        },
        "logo": {
            "type": "string"
        },
        "descriptionMarkdown": {
            "type": "string"
        },
        "graphQueries": {
            "type": "array",
            "items": [
                {
                    "type": "object",
                    "properties": {
                        "metricName": {
                            "type": "string"
                        },
                        "legend": {
                            "type": "string"
                        },
                        "baseQuery": {
                            "type": "string"
                        }
                    },
                    "required": [
                        "metricName",
                        "legend",
                        "baseQuery"
                    ]
                }
            ]
        },
        "sampleQueries": {
            "type": "array",
            "items": [
                {
                    "type": "object",
                    "properties": {
                        "description": {
                            "type": "string"
                        },
                        "query": {
                            "type": "string"
                        }
                    },
                    "required": [
                        "description",
                        "query"
                    ]
                }
            ]
        },
        "connectivityCriterias": {
            "type": "array",
            "items": [
                {
                    "type": "object",
                    "properties": {
                        "type": {
                            "type": "string"
                        },
                        "value": {
                            "type": "array",
                            "items": [
                                {
                                    "type": "string"
                                }
                            ]
                        }
                    },
                    "required": [
                        "type",
                        "value"
                    ]
                }
            ]
        },
        "dataTypes": {
            "type": "array",
            "items": [
                {
                    "type": "object",
                    "properties": {
                        "name": {
                            "type": "string"
                        },
                        "lastDataReceivedQuery": {
                            "type": "string"
                        }
                    },
                    "required": [
                        "name",
                        "lastDataReceivedQuery"
                    ]
                }
            ]
        },
        "availability": {
            "type": "object",
            "properties": {
                "status": {
                    "type": "integer"
                },
                "featureFlag": {
                    "type": "object",
                    "properties": {
                        "feature": {
                            "type": "string"
                        },
                        "featureStates": {
                            "type": "object",
                            "properties": {
                                "1": {
                                    "type": "integer"
                                },
                                "2": {
                                    "type": "integer"
                                },
                                "3": {
                                    "type": "integer"
                                },
                                "4": {
                                    "type": "integer"
                                },
                                "5": {
                                    "type": "integer"
                                }
                            },
                            "required": [
                                "1",
                                "2",
                                "3",
                                "4",
                                "5"
                            ]
                        }
                    },
                    "required": [
                        "feature",
                        "featureStates"
                    ]
                }
            },
            "required": [
                "status",
                "featureFlag"
            ]
        },
        "permissions": {
            "type": "object",
            "properties": {
                "resourceProvider": {
                    "type": "array",
                    "items": [
                        {
                            "type": "object",
                            "properties": {
                                "provider": {
                                    "type": "string"
                                },
                                "permissionsDisplayText": {
                                    "type": "string"
                                },
                                "providerDisplayName": {
                                    "type": "string"
                                },
                                "scope": {
                                    "type": "string"
                                },
                                "requiredPermissions": {
                                    "type": "object",
                                    "properties": {
                                        "read": {
                                            "type": "boolean"
                                        },
                                        "write": {
                                            "type": "boolean"
                                        },
                                        "delete": {
                                            "type": "boolean"
                                        }
                                    },
                                    "required": [
                                        "read",
                                        "write",
                                        "delete"
                                    ]
                                }
                            },
                            "required": [
                                "provider",
                                "permissionsDisplayText",
                                "providerDisplayName",
                                "scope",
                                "requiredPermissions"
                            ]
                        }
                    ]
                },
                "tenant": {
                    "type": "array",
                    "items": [
                        {
                            "type": "string"
                        },
                        {
                            "type": "string"
                        }
                    ]
                },
                "licenses": {
                    "type": "array",
                    "items": [
                        {
                            "type": "string"
                        }
                    ]
                }
            },
            "required": [
                "resourceProvider",
                "tenant",
                "licenses"
            ]
        },
        "instructionSteps": {
            "type": "array",
            "items": [
                {
                    "type": "object",
                    "properties": {
                        "title": {
                            "type": "string"
                        },
                        "description": {
                            "type": "string"
                        },
                        "instructions": {
                            "type": "array",
                            "items": [
                                {
                                    "type": "object",
                                    "properties": {
                                        "parameters": {
                                            "type": "object",
                                            "properties": {
                                                "connectorKind": {
                                                    "type": "string"
                                                },
                                                "title": {
                                                    "type": "string"
                                                },
                                                "enable": {
                                                    "type": "boolean"
                                                }
                                            },
                                            "required": [
                                                "connectorKind",
                                                "title",
                                                "enable"
                                            ]
                                        },
                                        "type": {
                                            "type": "string"
                                        }
                                    },
                                    "required": [
                                        "parameters",
                                        "type"
                                    ]
                                }
                            ]
                        }
                    },
                    "required": [
                        "title",
                        "description",
                        "instructions"
                    ]
                }
            ]
        },
        "caseGenerationSteps": {
            "type": "array",
            "items": [
                {
                    "type": "object",
                    "properties": {
                        "instructions": {
                            "type": "array",
                            "items": [
                                {
                                    "type": "object",
                                    "properties": {
                                        "parameters": {
                                            "type": "object",
                                            "properties": {
                                                "filterProduct": {
                                                    "type": "string"
                                                }
                                            },
                                            "required": [
                                                "filterProduct"
                                            ]
                                        },
                                        "type": {
                                            "type": "string"
                                        }
                                    },
                                    "required": [
                                        "parameters",
                                        "type"
                                    ]
                                }
                            ]
                        }
                    },
                    "required": [
                        "instructions"
                    ]
                }
            ]
        }
    },
    "required": [
        "id",
        "title",
        "publisher",
        "logo",
        "descriptionMarkdown",
        "graphQueries",
        "sampleQueries",
        "connectivityCriterias",
        "dataTypes",
        "availability",
        "permissions",
        "instructionSteps",
        "caseGenerationSteps"
    ]
}